{
  "body": "Focus on prompting and generating",
  "category": "image-generation",
  "commercial_use": 1,
  "community_guides": [],
  "community_guides_count": 0,
  "community_notes": [],
  "community_notes_count": 0,
  "date-added": "2026-07-22",
  "deployment": [
    "Docker",
    "Bare Metal",
    "Cloud",
    "Desktop App"
  ],
  "docker_available": 1,
  "docs_url": null,
  "featured": false,
  "features": [
    "Docker available",
    "GUI/no-code"
  ],
  "fine_tuning": 0,
  "github_url": "https://github.com/lllyasviel/Fooocus",
  "gui_available": 1,
  "hardware": [
    "GPU (NVIDIA)",
    "GPU (AMD)",
    "GPU (Apple Silicon)",
    "CPU"
  ],
  "language": [
    "Python"
  ],
  "last_updated": "2025-12-01",
  "last_verified": "2026-07-22",
  "license": "GPL-3.0",
  "maturity": "Mature / Maintenance",
  "min_ram_gb": 8,
  "model_format": [],
  "offline_after_setup": 1,
  "openai_api": 0,
  "paid_support": 0,
  "personas": [
    "Developer"
  ],
  "plain_description": "Fooocus generates professional-quality images from simple text descriptions — no complex settings or prompt engineering needed. It runs completely free and offline on your own computer, with an install that takes less than three clicks. Anyone can create beautiful visuals without a subscription or deep technical expertise.",
  "popularity_score": 51142,
  "quantization": 0,
  "recommended_ram_gb": null,
  "rest_api": 0,
  "setup_difficulty": "Easy",
  "slug": "fooocus",
  "tag": "Image Generation",
  "technical_description": "Fooocus is an offline, open-source image generation application built on the Stable Diffusion XL (SDXL) architecture. It provides a Gradio-based web UI for text-to-image generation and supports image-to-image workflows including inpainting, outpainting, upscaling, and variation. The application incorporates an offline GPT-2-based prompt expansion engine for automatic prompt enhancement and uses custom sampling algorithms for improved output quality. It supports multiple model presets (General, Realistic, Anime), LoRA and embedding integration, ControlNet-based image prompting, and InsightFace-based face swapping. Runtime is on local hardware with Nvidia GPU (min 4GB VRAM), AMD GPUs via DirectML/ROCm, Apple Silicon via MPS, or CPU-only mode.",
  "telemetry": "Opt-out",
  "title": "Fooocus",
  "url": "https://github.com/lllyasviel/Fooocus",
  "use_cases": [
    "Image Generation"
  ],
  "works_with": []
}
