{
  "body": "Search infrastructure for AI",
  "category": "vector-databases",
  "commercial_use": 1,
  "community_guides": [],
  "community_guides_count": 0,
  "community_notes": [],
  "community_notes_count": 0,
  "date-added": "2026-07-22",
  "deployment": [
    "Docker",
    "Bare Metal",
    "Kubernetes",
    "Cloud"
  ],
  "docker_available": 1,
  "docs_url": "https://docs.trychroma.com/",
  "featured": false,
  "features": [
    "Docker available"
  ],
  "fine_tuning": 0,
  "github_url": "https://github.com/chroma-core/chroma",
  "gui_available": 0,
  "hardware": [
    "CPU"
  ],
  "language": [
    "Rust"
  ],
  "last_updated": "2026-07-22",
  "last_verified": "2026-07-22",
  "license": "Apache-2.0",
  "maturity": "Production / Stable",
  "min_ram_gb": null,
  "model_format": [],
  "offline_after_setup": 1,
  "openai_api": 0,
  "paid_support": 0,
  "personas": [
    "Developer"
  ],
  "plain_description": "The big picture: Chroma is an open-source vector database that lets any application search and retrieve data using AI embeddings. Here's why it matters: you can add semantic search, recommendations, and retrieval-augmented generation (RAG) in minutes with just a few lines of code — no need to manage complex infrastructure yourself. The bottom line: go from zero to production-grade AI search with a simple four-function API.",
  "popularity_score": 28848,
  "quantization": 0,
  "recommended_ram_gb": null,
  "rest_api": 0,
  "setup_difficulty": "Easy",
  "slug": "chroma",
  "tag": "Vector Database",
  "technical_description": "Chroma is an open-source vector database project providing data infrastructure for AI applications. It stores and indexes vector embeddings alongside associated metadata and documents, supporting both exact and approximate nearest neighbor search. The runtime operates in an in-process embedded mode for rapid prototyping and a standalone client-server mode with a FastAPI-based HTTP interface. Chroma handles tokenization, embedding generation, and index management automatically. Client libraries are available for Python and JavaScript, with additional language support via the server API. A managed cloud service (Chroma Cloud) provides serverless vector, hybrid, and full-text search with automatic scaling.",
  "telemetry": "Unknown",
  "title": "Chroma",
  "url": "https://www.trychroma.com/",
  "use_cases": [
    "Vector Search",
    "RAG",
    "Document Processing"
  ],
  "works_with": []
}
