{
  "body": "SOTA Open Source TTS",
  "category": "text-to-speech",
  "commercial_use": 0,
  "community_guides": [],
  "community_guides_count": 0,
  "community_notes": [],
  "community_notes_count": 0,
  "date-added": "2026-07-22",
  "deployment": [
    "Docker",
    "Bare Metal"
  ],
  "docker_available": 1,
  "docs_url": "https://speech.fish.audio/",
  "featured": false,
  "features": [
    "Docker available",
    "REST API",
    "GUI/no-code"
  ],
  "fine_tuning": 0,
  "github_url": "https://github.com/fishaudio/fish-speech",
  "gui_available": 1,
  "hardware": [
    "GPU (NVIDIA)"
  ],
  "language": [
    "Python"
  ],
  "last_updated": "2026-06-09",
  "last_verified": "2026-07-22",
  "license": null,
  "maturity": "Production / Stable",
  "min_ram_gb": null,
  "model_format": [],
  "offline_after_setup": 1,
  "openai_api": 0,
  "paid_support": 0,
  "personas": [
    "Developer"
  ],
  "plain_description": "Fish Speech delivers studio-quality voice generation in 80+ languages — the most powerful open-source text-to-speech engine you can run yourself. Clone any voice from just 10 seconds of audio and control emotion, tone, and delivery with simple text commands. No phonemes, no complex setup, no ongoing API costs.",
  "popularity_score": 31349,
  "quantization": 0,
  "recommended_ram_gb": null,
  "rest_api": 1,
  "setup_difficulty": null,
  "slug": "fish-speech",
  "tag": "TTS",
  "technical_description": "Fish Speech (Fish Audio S2 Pro) is a state-of-the-art multilingual text-to-speech system built on a Dual-Autoregressive (Dual-AR) transformer architecture. The model comprises a slow AR with 4 billion parameters operating on the time axis to predict the primary semantic codebook, and a fast AR with 400 million parameters generating nine residual codebooks per time step using an RVQ audio codec with 10 codebooks at approximately 21 Hz. Trained on over 10 million hours of audio across 80-plus languages, S2 Pro supports sub-word level prosody control through natural language tags and natively handles multi-speaker and multi-turn generation. Inference acceleration via SGLang provides continuous batching, paged KV cache, and RadixAttention prefix caching, achieving a real-time factor of 0.195 and time-to-first-audio of approximately 100 milliseconds on a single NVIDIA H200 GPU. Deployment options include Docker, command-line interface, WebUI, and REST API server. Voice cloning is supported from reference samples of 10 to 30 seconds without requiring additional fine-tuning.",
  "telemetry": "Unknown",
  "title": "Fish Speech",
  "url": "https://github.com/fishaudio/fish-speech",
  "use_cases": [
    "Text-to-Speech"
  ],
  "works_with": []
}
