{
  "body": "Self-hosted AI coding assistant",
  "category": "code-assistants",
  "commercial_use": 0,
  "community_guides": [],
  "community_guides_count": 0,
  "community_notes": [],
  "community_notes_count": 0,
  "date-added": "2026-07-22",
  "deployment": [
    "Docker",
    "Bare Metal",
    "Cloud"
  ],
  "docker_available": 1,
  "docs_url": "https://tabby.tabbyml.com/docs/welcome/",
  "featured": false,
  "features": [
    "Docker available",
    "REST API",
    "GUI/no-code"
  ],
  "fine_tuning": 0,
  "github_url": "https://github.com/TabbyML/tabby",
  "gui_available": 1,
  "hardware": [
    "CPU",
    "GPU (NVIDIA)",
    "GPU (Apple Silicon)"
  ],
  "language": [
    "Rust"
  ],
  "last_updated": "2026-06-30",
  "last_verified": "2026-07-22",
  "license": null,
  "maturity": "Production / Stable",
  "min_ram_gb": null,
  "model_format": [],
  "offline_after_setup": 0,
  "openai_api": 0,
  "paid_support": 0,
  "personas": [
    "Developer"
  ],
  "plain_description": "Tabby is a self-hosted AI coding assistant that helps your developers write code faster while keeping all data on your own infrastructure. No per-seat fees and no external cloud dependency. Your team gets AI-powered code completion and chat backed by your private codebase.",
  "popularity_score": 33778,
  "quantization": 0,
  "recommended_ram_gb": null,
  "rest_api": 1,
  "setup_difficulty": "Easy",
  "slug": "tabby",
  "tag": "Coding Assistant",
  "technical_description": "Tabby is a self-hosted AI coding assistant server written in Rust. It provides code completion and conversational chat via an OpenAPI-compatible REST interface. The server runs as a single self-contained binary or Docker container with no external database or cloud service dependencies. Inference supports consumer-grade NVIDIA GPUs via CUDA and Apple Silicon via Metal, with CPU fallback. Tabby integrates with IDEs including VSCode, IntelliJ, Vim, and Eclipse through LSP-based plugins and exposes an OpenAPI specification for custom integrations. Key capabilities include RAG-based code completion using repository context, an Answer Engine for engineering knowledge retrieval, and a web-based administration UI for team management, SSO, and configuration.",
  "telemetry": "Unknown",
  "title": "Tabby",
  "url": "https://tabby.tabbyml.com/",
  "use_cases": [
    "Code Generation",
    "Chat Assistant",
    "RAG"
  ],
  "works_with": [
    "VSCode",
    "Vim",
    "IntelliJ",
    "Eclipse",
    "OpenAPI"
  ]
}
