{
  "body": "The official API server for Exllama. OAI compatible, lightweight, and fast.",
  "category": "llm-inference",
  "commercial_use": 1,
  "community_guides": [],
  "community_guides_count": 0,
  "community_notes": [],
  "community_notes_count": 0,
  "date-added": "2026-07-22",
  "deployment": [
    "Docker",
    "Bare Metal"
  ],
  "docker_available": 1,
  "docs_url": "https://theroyallab.github.io/tabbyAPI",
  "featured": false,
  "features": [
    "OpenAI-compatible API",
    "Docker available",
    "REST API"
  ],
  "fine_tuning": 0,
  "github_url": "https://github.com/theroyallab/tabbyAPI",
  "gui_available": 0,
  "hardware": [
    "GPU (NVIDIA)"
  ],
  "language": [
    "Python"
  ],
  "last_updated": "2026-07-18",
  "last_verified": "2026-07-22",
  "license": "AGPL-3.0",
  "maturity": "Alpha",
  "min_ram_gb": null,
  "model_format": [],
  "offline_after_setup": 1,
  "openai_api": 1,
  "paid_support": 0,
  "personas": [
    "Developer"
  ],
  "plain_description": "TabbyAPI lets you run powerful open-source LLMs on your own hardware with a simple API that works just like OpenAI's. It's built specifically for ExLlama models, giving you fast inference with features like tool calling, structured output, and concurrent users. The bottom line: get private, low-latency AI without depending on external services.",
  "popularity_score": 1282,
  "quantization": 0,
  "recommended_ram_gb": null,
  "rest_api": 1,
  "setup_difficulty": "Medium",
  "slug": "tabbyapi",
  "tag": "Model Serving",
  "technical_description": "TabbyAPI is a FastAPI-based inference server for ExLlamaV3 models that exposes an OpenAI-compatible API endpoint for text generation and embeddings. It uses a continuous batching engine with paged attention for concurrent request handling on NVIDIA Ampere+ GPUs. The server supports speculative decoding via draft models, JSON schema / Regex / EBNF constrained generation, and OAI-style tool/function calling with Jinja2 template support. Deployment is available via Docker (CUDA image on GHCR) or bare metal, with model loading from HuggingFace or local storage.",
  "telemetry": "None",
  "title": "TabbyAPI",
  "url": "https://github.com/theroyallab/tabbyAPI",
  "use_cases": [
    "Chat Assistant",
    "Model Serving",
    "Vector Search",
    "Agentic Workflows"
  ],
  "works_with": [
    "AI Horde"
  ]
}
